### DISCUSSION TITLE
Accessing a gitea instance that sits behind a reverse proxy not working

### DISCUSSION THREAD

**Discussion by glillico** [cooperspencer/gickup#392] [Q&A]
I have a gitea instance that sits behind a nginx proxy manger which manages SSL certs and forces https.

When gickup runs it say it is using https but the starting backup line says it is using http and I am seeing "authentication required: Unauthorized" messages in the logs.  If I turn off forced SSL it works fine.

### conf.yml
source:
  gitea:
    - token: TOKEN
      user: USERNAME
      url: https://gitea.mydomain.net
      username: USERNAME

destination:
  local:
    - path: /backup
      structured: true

cron: 40 03 * * *

### Log entries 
2026-05-14T04:18:22+01:00 INF grabbing repositories from USERNAME stage=gitea url=https://gitea.mydomain.net
2026-05-14T04:18:22+01:00 INF starting backup for http://gitea.mydomain.net/USERNAME/myhome.git stage=backup
2026-05-14T04:18:22+01:00 INF cloning gitea.mydomain.net/USERNAME/myhome path=/backup stage=locally
2026-05-14T04:18:22+01:00 WRN retry 1 from 5 error="authentication required: Unauthorized\n" path=/backup stage=locally

**Comment by cooperspencer** [comment]
can you remove `username: USERNAME` from your config?

**Reply by glillico** [reply]
Hi,

That does not make any difference.

**Reply by cooperspencer** [reply]
that's weird. I used nginx in the past and everything worked perfectly fine.

Would you mind sharing your nginx config?

**Reply by glillico** [reply]
Hi
I’m using jc21/nginx-proxy-manager:2.14.0 not nginx directly.  I’ve got some ideas for some more testing, I will update further as soon as I can.

**Reply by glillico** [reply]
OK so I've done some packet captures using TCP dump on the gitea host and found the following.

The conf.yml ive used for testing is, 

source:
  gitea:
    - token: MYTOKEN
      user: TEST-USER
      url: https://GITEA-HOST
destination:
  local:
    - path: /backup
      structured: true

When Force SSL is ON in nginx proxy manager, gickup is making connections on port 80, but this returns a 301 redirect from nginx proxy manager, and I see the "authentication required: Unauthorized\n" error in the gickup logs.

  14:38:35.334841 IP GICKUP-HOST.50632 > GITEA-HOST.80: Flags [P.], seq 1:256, ack 1, win 502, options [nop,nop,TS val 947602629 ecr 3150219513], length 255: HTTP: GET /TEST-USER/TEST-REPO.git/info/refs?service=git-upload-pack HTTP/1.1
  14:38:35.334881 IP GITEA-HOST.80 > GICKUP-HOST.50632: Flags [.], ack 256, win 508, options [nop,nop,TS val 3150219513 ecr 947602629], length 0
  14:38:35.334982 IP GITEA-HOST.80 > GICKUP-HOST.50632: Flags [P.], seq 1:438, ack 256, win 508, options [nop,nop,TS val 3150219513 ecr 947602629], length 437: HTTP: HTTP/1.1 301 Moved Permanently

When Force SSL is OFF in nginx proxy manager, gickup is making connections on port 80 but these get a 200 responce and everything works as expected.

  14:36:06.624724 IP GICKUP-HOST.55284 > GITEA-HOST.80: Flags [P.], seq 511:766, ack 2151, win 502, options [nop,nop,TS val 947453918 ecr 3150070802], length 255: HTTP: GET /TEST-USER/TEST-REPO.git/info/refs?service=git-upload-pack HTTP/1.1
  14:36:06.624808 IP GITEA-HOST.80 > GICKUP-HOST.55284: Flags [.], ack 766, win 506, options [nop,nop,TS val 3150070803 ecr 947453918], length 0
  14:36:06.715299 IP GITEA-HOST.80 > GICKUP-HOST.55284: Flags [P.], seq 2151:3226, ack 766, win 506, options [nop,nop,TS val 3150070894 ecr 947453918], length 1075: HTTP: HTTP/1.1 200 OK

Could it be something to do with the 301 redirecct that is causing gickup an issue?

**Reply by cooperspencer** [reply]
It could be that the gitea module doesn't follow a redirect.

I will actually try to setup a test instance with `jc21/nginx-proxy-manager:2.14.0` and check if I can somehow make it work. I'll get back to you as soon as I figured something out or failed spectacularly.
